{
  "kind": "win-pcinfo.cross-domain-guidance-policy",
  "contractVersion": "1.0.0",
  "release": "2.0.0-preview.1",
  "policyId": "win-pcinfo.cross-domain-guidance/1.0.0",
  "evidenceProfileId": "profile:device-firmware-identity-administrator-policy-software-resource-network-certificate-and-microsoft-connectivity-readiness",
  "authoritativeSources": [
    {
      "sourceId": "source:microsoft.zero-trust-m365-plan",
      "title": "Zero Trust deployment with Microsoft 365",
      "url": "https://learn.microsoft.com/en-us/security/zero-trust/microsoft-365-zero-trust",
      "reviewedOn": "2026-08-16"
    },
    {
      "sourceId": "source:microsoft.intune-zero-trust-layers",
      "title": "Zero Trust deployment approach with Microsoft Intune",
      "url": "https://learn.microsoft.com/en-us/intune/fundamentals/zero-trust-deployment",
      "reviewedOn": "2026-08-16"
    },
    {
      "sourceId": "source:microsoft.zero-trust-endpoints",
      "title": "Secure endpoints with Zero Trust",
      "url": "https://learn.microsoft.com/en-us/security/zero-trust/deploy/endpoints",
      "reviewedOn": "2026-08-16"
    },
    {
      "sourceId": "source:microsoft.cloud-native-endpoints-planning",
      "title": "Update your workloads to support cloud-native endpoints",
      "url": "https://learn.microsoft.com/en-us/intune/solutions/cloud-native-endpoints/planning-guide",
      "reviewedOn": "2026-08-16"
    }
  ],
  "rules": [
    {
      "findingKind": "identity-foundation",
      "ruleId": "rule:cross-domain.identity-foundation/1.0.0",
      "operationId": "op:rule.cross-domain.identity-foundation.evaluate",
      "title": "Identity foundation",
      "sourceRuleIds": [
        "rule:identity.assessment-user-context/1.0.0",
        "rule:identity.device-registration-context/1.0.0",
        "rule:identity.work-school-enrollment-context/1.0.0"
      ],
      "source": "ReleaseEmbeddedValidatedCrossDomainRule",
      "executionContext": "InProcessValidatedAssessmentRecord",
      "privilege": "NoElevation",
      "networkBehavior": "OfflineOnly",
      "executable": "NoneInProcess",
      "dependencies": [],
      "mayPrompt": false,
      "mayInstall": false,
      "mayDownload": false,
      "maySelfElevate": false,
      "writesAllowed": false,
      "maximumAttempts": 1,
      "deadlineMilliseconds": 100,
      "maximumInputFindings": 3,
      "maximumOutputFindings": 1,
      "cleanup": "NoArtifacts",
      "missingEvidenceOutcome": "Indeterminate",
      "severityWhenNeedsAttention": "Medium",
      "confidenceWhenComplete": "High",
      "indeterminateReasonCode": "FINDING.CROSS_DOMAIN_IDENTITY_EVIDENCE_INCOMPLETE"
    },
    {
      "findingKind": "management-plane",
      "ruleId": "rule:cross-domain.management-plane/1.0.0",
      "operationId": "op:rule.cross-domain.management-plane.evaluate",
      "title": "Management-plane prerequisites",
      "sourceRuleIds": [
        "rule:microsoft-connectivity.reachability/1.0.0",
        "rule:microsoft-connectivity.tls-inspection/1.0.0",
        "rule:certificate.presence/1.0.0",
        "rule:certificate.trust/1.0.0",
        "rule:network.local-only-coverage/1.0.0"
      ],
      "source": "ReleaseEmbeddedValidatedCrossDomainRule",
      "executionContext": "InProcessValidatedAssessmentRecord",
      "privilege": "NoElevation",
      "networkBehavior": "OfflineOnly",
      "executable": "NoneInProcess",
      "dependencies": [],
      "mayPrompt": false,
      "mayInstall": false,
      "mayDownload": false,
      "maySelfElevate": false,
      "writesAllowed": false,
      "maximumAttempts": 1,
      "deadlineMilliseconds": 100,
      "maximumInputFindings": 16,
      "maximumOutputFindings": 1,
      "cleanup": "NoArtifacts",
      "missingEvidenceOutcome": "Indeterminate",
      "severityWhenNeedsAttention": "High",
      "confidenceWhenComplete": "High",
      "indeterminateReasonCode": "FINDING.CROSS_DOMAIN_MANAGEMENT_EVIDENCE_INCOMPLETE"
    },
    {
      "findingKind": "dependency-transition",
      "ruleId": "rule:cross-domain.dependency-transition/1.0.0",
      "operationId": "op:rule.cross-domain.dependency-transition.evaluate",
      "title": "Dependency transition",
      "sourceRuleIds": [
        "rule:identity.local-administrator-exposure/1.0.0",
        "rule:resource.user-migration-dependencies/1.0.0",
        "rule:resource.peripheral-migration-dependencies/1.0.0",
        "rule:software.machine-inventory/1.0.0",
        "rule:software.assessment-user-inventory/1.0.0"
      ],
      "source": "ReleaseEmbeddedValidatedCrossDomainRule",
      "executionContext": "InProcessValidatedAssessmentRecord",
      "privilege": "NoElevation",
      "networkBehavior": "OfflineOnly",
      "executable": "NoneInProcess",
      "dependencies": [],
      "mayPrompt": false,
      "mayInstall": false,
      "mayDownload": false,
      "maySelfElevate": false,
      "writesAllowed": false,
      "maximumAttempts": 1,
      "deadlineMilliseconds": 100,
      "maximumInputFindings": 8,
      "maximumOutputFindings": 1,
      "cleanup": "NoArtifacts",
      "missingEvidenceOutcome": "Indeterminate",
      "severityWhenNeedsAttention": "Medium",
      "confidenceWhenComplete": "High",
      "indeterminateReasonCode": "FINDING.CROSS_DOMAIN_DEPENDENCY_EVIDENCE_INCOMPLETE"
    },
    {
      "findingKind": "policy-modernization",
      "ruleId": "rule:cross-domain.policy-modernization/1.0.0",
      "operationId": "op:rule.cross-domain.policy-modernization.evaluate",
      "title": "Policy modernization",
      "sourceRuleIds": [
        "rule:policy.applied-policy-coverage/1.0.0",
        "rule:policy.local-security-policy-coverage/1.0.0",
        "rule:policy.applied-order-conflict/1.0.0",
        "rule:policy.security-control-coverage/1.0.0",
        "rule:policy.security-control-constraint/1.0.0",
        "rule:policy.mdm-policy-csp-coverage/1.0.0",
        "rule:policy.policy-csp-gpo-conflict/1.0.0"
      ],
      "source": "ReleaseEmbeddedValidatedCrossDomainRule",
      "executionContext": "InProcessValidatedAssessmentRecord",
      "privilege": "NoElevation",
      "networkBehavior": "OfflineOnly",
      "executable": "NoneInProcess",
      "dependencies": [],
      "mayPrompt": false,
      "mayInstall": false,
      "mayDownload": false,
      "maySelfElevate": false,
      "writesAllowed": false,
      "maximumAttempts": 1,
      "deadlineMilliseconds": 100,
      "maximumInputFindings": 8,
      "maximumOutputFindings": 1,
      "cleanup": "NoArtifacts",
      "missingEvidenceOutcome": "Indeterminate",
      "severityWhenNeedsAttention": "Medium",
      "confidenceWhenComplete": "High",
      "indeterminateReasonCode": "FINDING.CROSS_DOMAIN_POLICY_EVIDENCE_INCOMPLETE"
    },
    {
      "findingKind": "zero-trust-path",
      "ruleId": "rule:cross-domain.zero-trust-path/1.0.0",
      "operationId": "op:rule.cross-domain.zero-trust-path.evaluate",
      "title": "Cautious Zero Trust path",
      "sourceRuleIds": [
        "rule:cross-domain.identity-foundation/1.0.0",
        "rule:cross-domain.management-plane/1.0.0",
        "rule:cross-domain.dependency-transition/1.0.0",
        "rule:cross-domain.policy-modernization/1.0.0"
      ],
      "source": "ReleaseEmbeddedValidatedCrossDomainRule",
      "executionContext": "InProcessValidatedAssessmentRecord",
      "privilege": "NoElevation",
      "networkBehavior": "OfflineOnly",
      "executable": "NoneInProcess",
      "dependencies": [],
      "mayPrompt": false,
      "mayInstall": false,
      "mayDownload": false,
      "maySelfElevate": false,
      "writesAllowed": false,
      "maximumAttempts": 1,
      "deadlineMilliseconds": 100,
      "maximumInputFindings": 8,
      "maximumOutputFindings": 1,
      "cleanup": "NoArtifacts",
      "missingEvidenceOutcome": "Indeterminate",
      "severityWhenNeedsAttention": "Medium",
      "confidenceWhenComplete": "High",
      "indeterminateReasonCode": "FINDING.CROSS_DOMAIN_PATH_EVIDENCE_INCOMPLETE"
    }
  ],
  "recommendations": [
    {
      "definitionId": "recommendation:cross-domain.review-identity-foundation/1.0.0",
      "findingKind": "identity-foundation",
      "title": "Review identity foundation and target cloud identity path",
      "purpose": "Confirm the intended Microsoft Entra registration or join outcome before changing provisioning, enrollment, or access policy.",
      "priority": "ImmediateReview",
      "priorityExplanation": "Cloud identity targeting comes first because later management and access controls depend on it.",
      "prerequisites": [
        "Confirm that the Assessment User Context and local registration evidence are complete.",
        "Resolve tenant-side decisions about the intended join or enrollment path."
      ],
      "caution": "One endpoint cannot prove tenant assignment, licensing, compliance, or organization intent.",
      "responsibleRole": "MicrosoftEntraAndIntuneAdministrator",
      "verification": "Validate the approved target state in the authorized Microsoft Entra and Intune administration boundaries before device reprovisioning.",
      "authoritativeReferences": [
        "https://learn.microsoft.com/en-us/security/zero-trust/deploy/endpoints",
        "https://learn.microsoft.com/en-us/security/zero-trust/microsoft-365-zero-trust"
      ]
    },
    {
      "definitionId": "recommendation:cross-domain.review-connectivity-and-trust/1.0.0",
      "findingKind": "management-plane",
      "title": "Review enrollment connectivity, DNS, and trust prerequisites",
      "purpose": "Confirm that device-enrollment and identity endpoints can be reached through the approved DNS, proxy, TLS, and certificate path.",
      "priority": "ImmediateReview",
      "priorityExplanation": "Enrollment and access flows fail early when network or trust prerequisites are unresolved.",
      "prerequisites": [
        "Approve and interpret the bounded connectivity and certificate evidence together.",